{
  "mapId": "MAP_C_3",
  "mapName": "Mixed Map",
  "totalRooms": 3,
  "rooms": [
    {
      "id": "C01",
      "type": "room",
      "connections": [
        "C02",
        "C03"
      ],
      "coordinates": "X10Y10",
      "directions": {
        "east": "C02",
        "south": "C03"
      },
      "tags": [],
      "purpose": "unknown",
      "landmark": false,
      "dangerLevel": "medium",
      "name": "Sable Crossroads"
    },
    {
      "id": "C02",
      "type": "room",
      "connections": [
        "C01"
      ],
      "coordinates": "X11Y10",
      "directions": {
        "west": "C01"
      },
      "tags": [
        "dead_end"
      ],
      "purpose": "unknown",
      "landmark": true,
      "dangerLevel": "medium",
      "name": "Graven Stillhouse"
    },
    {
      "id": "C03",
      "type": "room",
      "connections": [
        "C01"
      ],
      "coordinates": "X10Y11",
      "directions": {
        "north": "C01"
      },
      "tags": [
        "dead_end"
      ],
      "purpose": "unknown",
      "landmark": true,
      "dangerLevel": "medium",
      "name": "Witherbone Alcove"
    }
  ],
  "layout": [
    [
      "C01",
      "C02",
      "C03"
    ]
  ],
  "startRoom": "C01",
  "version": "1.1",
  "notes": "Extended schema with AI-friendly navigation fields",
  "spatialContractVersion": 1
}
