{
  "mapId": "MAP_H_3",
  "mapName": "Mixed Map",
  "totalRooms": 3,
  "rooms": [
    {
      "id": "H01",
      "type": "room",
      "connections": [
        "H02"
      ],
      "coordinates": "X10Y10",
      "directions": {
        "east": "H02"
      },
      "tags": [
        "dead_end"
      ],
      "purpose": "unknown",
      "landmark": true,
      "dangerLevel": "medium",
      "name": "Echoing Oathway"
    },
    {
      "id": "H02",
      "type": "room",
      "connections": [
        "H01",
        "H03"
      ],
      "coordinates": "X11Y10",
      "directions": {
        "west": "H01",
        "east": "H03"
      },
      "tags": [],
      "purpose": "unknown",
      "landmark": false,
      "dangerLevel": "medium",
      "name": "Brass Lantern Junction"
    },
    {
      "id": "H03",
      "type": "room",
      "connections": [
        "H02"
      ],
      "coordinates": "X12Y10",
      "directions": {
        "west": "H02"
      },
      "tags": [
        "dead_end"
      ],
      "purpose": "unknown",
      "landmark": true,
      "dangerLevel": "medium",
      "name": "Bound Ledger Nook"
    }
  ],
  "layout": [
    [
      "H01",
      "H02",
      "H03"
    ]
  ],
  "startRoom": "H02",
  "version": "1.1",
  "notes": "Extended schema with AI-friendly navigation fields",
  "spatialContractVersion": 1
}