{
  "mapId": "MAP_TW001",
  "mapName": "Thornwood Map",
  "totalRooms": 6,
  "rooms": [
    {
      "id": "TW01",
      "type": "clearing",
      "connections": [
        "TW02",
        "TW04",
        "TW06"
      ],
      "coordinates": "X2Y2",
      "name": "Ambush Site",
      "directions": {
        "east": "TW02",
        "north": "TW04"
      }
    },
    {
      "id": "TW02",
      "type": "path",
      "connections": [
        "TW01",
        "TW03",
        "TW05"
      ],
      "coordinates": "X3Y2",
      "name": "Bandit Trail",
      "directions": {
        "west": "TW01",
        "north": "TW03",
        "south": "TW05"
      }
    },
    {
      "id": "TW03",
      "type": "clearing",
      "connections": [
        "TW02",
        "TW04"
      ],
      "coordinates": "X3Y1",
      "name": "Abandoned Camp",
      "directions": {
        "south": "TW02",
        "west": "TW04"
      }
    },
    {
      "id": "TW04",
      "type": "grove",
      "connections": [
        "TW01",
        "TW03"
      ],
      "coordinates": "X2Y1",
      "name": "Thornheart Grove",
      "directions": {
        "south": "TW01",
        "east": "TW03"
      }
    },
    {
      "id": "TW05",
      "type": "stronghold",
      "connections": [
        "TW02"
      ],
      "coordinates": "X3Y3",
      "name": "Bandit Stronghold",
      "directions": {
        "north": "TW02"
      }
    },
    {
      "id": "TW06",
      "type": "cave",
      "connections": [
        "TW04"
      ],
      "coordinates": "X1Y1",
      "name": "Wolf's Den Cave",
      "directions": {
        "east": "TW04"
      }
    }
  ],
  "layout": [
    [
      "TW06",
      "TW04",
      "TW03"
    ],
    [
      "   ",
      "TW01",
      "TW02"
    ],
    [
      "   ",
      "   ",
      "TW05"
    ]
  ],
  "startRoom": "TW01",
  "spatialContractVersion": 1
}
