{
  "mapId": "MAP_A_3",
  "mapName": "Town Map",
  "totalRooms": 3,
  "rooms": [
    {
      "id": "A01",
      "type": "market",
      "connections": [
        "A02",
        "A03"
      ],
      "coordinates": "X10Y10",
      "directions": {
        "east": "A02",
        "south": "A03"
      },
      "tags": [],
      "purpose": "unknown",
      "landmark": false,
      "dangerLevel": "low",
      "name": "Silent Harvest Market"
    },
    {
      "id": "A02",
      "type": "guild",
      "connections": [
        "A01"
      ],
      "coordinates": "X11Y10",
      "directions": {
        "west": "A01"
      },
      "tags": [
        "dead_end"
      ],
      "purpose": "unknown",
      "landmark": true,
      "dangerLevel": "low",
      "name": "Embalmer's Guildhall"
    },
    {
      "id": "A03",
      "type": "tavern",
      "connections": [
        "A01"
      ],
      "coordinates": "X10Y11",
      "directions": {
        "north": "A01"
      },
      "tags": [
        "rest",
        "dead_end"
      ],
      "purpose": "safe_haven",
      "landmark": true,
      "dangerLevel": "low",
      "name": "The Stillroot Tavern"
    }
  ],
  "layout": [
    [
      "A01",
      "A02",
      "A03"
    ]
  ],
  "startRoom": "A01",
  "version": "1.1",
  "notes": "Extended schema with AI-friendly navigation fields",
  "spatialContractVersion": 1
}
