{
  "mapId": "MAP_G001",
  "mapName": "Gloamwood Trail Map",
  "totalRooms": 9,
  "rooms": [
    {
      "id": "AA01",
      "name": "Witchlight Trailhead",
      "type": "trail",
      "connections": [
        "AA02"
      ],
      "coordinates": "X2Y1",
      "directions": {
        "east": "AA02"
      }
    },
    {
      "id": "AA02",
      "name": "Abandoned Ranger Outpost",
      "type": "outpost",
      "connections": [
        "AA01",
        "AA04",
        "AA08"
      ],
      "coordinates": "X3Y1",
      "directions": {
        "west": "AA01",
        "south": "AA04",
        "east": "AA08"
      }
    },
    {
      "id": "AA08",
      "name": "Secret Forest Path",
      "type": "path",
      "connections": [
        "AA02",
        "AA09"
      ],
      "coordinates": "X4Y1",
      "directions": {
        "west": "AA02",
        "east": "AA09"
      }
    },
    {
      "id": "AA09",
      "name": "Hidden Keep Entrance",
      "type": "entrance",
      "connections": [
        "AA08"
      ],
      "coordinates": "X5Y1",
      "directions": {
        "west": "AA08"
      }
    },
    {
      "id": "AA03",
      "name": "The Withered Shrine",
      "type": "shrine",
      "connections": [
        "AA05"
      ],
      "coordinates": "X1Y2",
      "directions": {
        "south": "AA05"
      }
    },
    {
      "id": "AA04",
      "name": "Lost Ward Circle",
      "type": "ritual",
      "connections": [
        "AA02",
        "AA07"
      ],
      "coordinates": "X3Y2",
      "directions": {
        "north": "AA02",
        "south": "AA07"
      }
    },
    {
      "id": "AA05",
      "name": "Boggard Marsh",
      "type": "marsh",
      "connections": [
        "AA03",
        "AA06"
      ],
      "coordinates": "X1Y3",
      "directions": {
        "north": "AA03",
        "east": "AA06"
      }
    },
    {
      "id": "AA06",
      "name": "Spectral Clearing",
      "type": "clearing",
      "connections": [
        "AA05",
        "AA07"
      ],
      "coordinates": "X2Y3",
      "directions": {
        "west": "AA05",
        "east": "AA07"
      }
    },
    {
      "id": "AA07",
      "name": "Keeper's Cottage",
      "type": "cottage",
      "connections": [
        "AA04",
        "AA06"
      ],
      "coordinates": "X3Y3",
      "directions": {
        "north": "AA04",
        "west": "AA06"
      }
    }
  ],
  "layout": [
    [
      "   ",
      "AA01",
      "AA02",
      "AA08",
      "AA09"
    ],
    [
      "AA03",
      "   ",
      "AA04",
      "   ",
      "   "
    ],
    [
      "AA05",
      "AA06",
      "AA07",
      "   ",
      "   "
    ]
  ],
  "startRoom": "AA01",
  "spatialContractVersion": 1
}
