{
  "mapId": "MAP_RO001",
  "mapName": "Rangers' Outpost Map",
  "totalRooms": 6,
  "rooms": [
    {
      "id": "RO01",
      "type": "crossroads",
      "connections": [
        "RO02",
        "RO03",
        "RO04"
      ],
      "coordinates": "X2Y2",
      "name": "Forked Trails Crossing",
      "directions": {
        "south": "RO02",
        "west": "RO03",
        "east": "RO04"
      }
    },
    {
      "id": "RO02",
      "type": "riverside",
      "connections": [
        "RO01",
        "RO04"
      ],
      "coordinates": "X2Y3",
      "name": "Moonlit Waters Edge",
      "directions": {
        "north": "RO01"
      }
    },
    {
      "id": "RO03",
      "type": "ruins",
      "connections": [
        "RO01",
        "RO05",
        "RO06"
      ],
      "coordinates": "X1Y2",
      "name": "Shattered Sentinel Stones",
      "directions": {
        "east": "RO01",
        "north": "RO05",
        "south": "RO06"
      }
    },
    {
      "id": "RO04",
      "type": "riverside",
      "connections": [
        "RO01"
      ],
      "coordinates": "X3Y2",
      "name": "Mistshadow Ford",
      "directions": {
        "west": "RO01"
      }
    },
    {
      "id": "RO05",
      "type": "ruins",
      "connections": [
        "RO03"
      ],
      "coordinates": "X1Y1",
      "name": "Forgotten Waystation",
      "directions": {
        "south": "RO03"
      }
    },
    {
      "id": "RO06",
      "type": "ruins",
      "connections": [
        "RO03"
      ],
      "coordinates": "X1Y3",
      "name": "North Tower Overlook",
      "directions": {
        "north": "RO03"
      }
    }
  ],
  "layout": [
    [
      "RO05",
      "   ",
      "   "
    ],
    [
      "RO03",
      "RO01",
      "RO04"
    ],
    [
      "   ",
      "RO02",
      "   "
    ],
    [
      "RO06",
      "   ",
      "   "
    ]
  ],
  "startRoom": "RO01",
  "spatialContractVersion": 1
}
