{
  "mapId": "MAP_H_3",
  "mapName": "Dungeon Map",
  "totalRooms": 3,
  "rooms": [
    {
      "id": "H01",
      "type": "shrine",
      "connections": [
        "H02",
        "H03"
      ],
      "coordinates": "X10Y10",
      "directions": {
        "east": "H02",
        "south": "H03"
      },
      "tags": [],
      "purpose": "unknown",
      "landmark": false,
      "dangerLevel": "extreme",
      "name": "Sanctum of Echoed Warnings"
    },
    {
      "id": "H02",
      "type": "vault",
      "connections": [
        "H01"
      ],
      "coordinates": "X11Y10",
      "directions": {
        "west": "H01"
      },
      "tags": [
        "dead_end"
      ],
      "purpose": "quest_goal",
      "landmark": true,
      "dangerLevel": "extreme",
      "name": "Vault of the Drowned Oath"
    },
    {
      "id": "H03",
      "type": "shrine",
      "connections": [
        "H01"
      ],
      "coordinates": "X10Y11",
      "directions": {
        "north": "H01"
      },
      "tags": [
        "dead_end"
      ],
      "purpose": "unknown",
      "landmark": true,
      "dangerLevel": "extreme",
      "name": "Reliquary of Sorrowful Depths"
    }
  ],
  "layout": [
    [
      "H01",
      "H02",
      "H03"
    ]
  ],
  "startRoom": "H01",
  "version": "1.1",
  "notes": "Extended schema with AI-friendly navigation fields",
  "spatialContractVersion": 1
}
