{
  "mapId": "MAP_5",
  "mapName": "Town Map",
  "totalRooms": 6,
  "rooms": [
    {
      "id": "AE01",
      "name": "Harrow's Hollow General Store",
      "type": "shop",
      "connections": [
        "AE02",
        "AE03",
        "AE04",
        "AE05"
      ],
      "coordinates": "X2Y2",
      "directions": {
        "east": "AE02",
        "south": "AE03",
        "north": "AE04",
        "west": "AE05"
      }
    },
    {
      "id": "AE02",
      "name": "Harrow's Hollow Town Square",
      "type": "square",
      "connections": [
        "AE01"
      ],
      "coordinates": "X3Y2",
      "directions": {
        "west": "AE01"
      }
    },
    {
      "id": "AE03",
      "name": "East Gate and Guardhouse",
      "type": "gate",
      "connections": [
        "AE01",
        "AE06"
      ],
      "coordinates": "X2Y3",
      "directions": {
        "north": "AE01",
        "west": "AE06"
      }
    },
    {
      "id": "AE04",
      "name": "Militia Barracks",
      "type": "barracks",
      "connections": [
        "AE01"
      ],
      "coordinates": "X2Y1",
      "directions": {
        "south": "AE01"
      }
    },
    {
      "id": "AE05",
      "name": "The Wyrd Lantern Inn",
      "type": "tavern",
      "connections": [
        "AE01",
        "AE06"
      ],
      "coordinates": "X1Y2",
      "directions": {
        "east": "AE01",
        "south": "AE06"
      }
    },
    {
      "id": "AE06",
      "name": "Smuggler's Tunnel",
      "type": "tunnel",
      "connections": [
        "AE05",
        "AE03"
      ],
      "coordinates": "X1Y3",
      "directions": {
        "north": "AE05",
        "east": "AE03"
      }
    }
  ],
  "layout": [
    [
      "   ",
      "AE04",
      "   "
    ],
    [
      "AE05",
      "AE01",
      "AE02"
    ],
    [
      "AE06",
      "AE03",
      "   "
    ]
  ],
  "startRoom": "AE01",
  "spatialContractVersion": 1
}
